Question,Option A,Option B,Option C,Option D,Option E,Answer
What is it called when a person takes material into their mind from the environ-  ment?,Assimilation,Accommodation,Classification,Stage,Recall,A
Which of the following represents that strongest correlation?,-.10  Byra.23  C) -.44  D) +.89  E,+55  The correct answer is D:) + .89.  3) Which is NOT a step in the scientific method?  A) Gather information  B) Generate hypothesis,Test hypothesis,Revise,None of the above,E
The difference between reality and self-concept is called,Shaping,Behavior rehearsal,Modeling,Incongruence,None of the above,D
Role playing social situations or behaviors is called,Shaping,Behavior rehearsal,Modeling,Incongruence,None of the above,B
What is it called when a person has consistent fear of a serious disease?,Hypochondria,Arachnophobia,Phobia,Obsessive-compulsive disorder,Schizophrenia,A
Which of the following created the client-centered theory of psychology?,Alfred Kinsey,Carl Jung,B. F. Skinner,Carl Rogers,Ivan Pavlov,D
What is it called when a person experiences hallucinations and delusions?,Hypochondria,Arachnophobia,Phobia,Obsessive-compulsive disorder,Schizophrenia,E
Which of the following conducted the Baby Monkey experiment?,Harry Harlow,Mary Ainsworth,Sigmund Freud,Jean Piaget,Lawrence Kohlberg,A
Which of the following studied temperament?,Harry Harlow,Mary Ainsworth,Sigmund Freud,Jean Piaget,Lawrence Kohlberg,B
Cocaine is which of the following?,Sedative,Narcotic,Stimulant,Hallucinogen,Cannabis,C
Which of the following became famous for his experiments with dogs and condi-  tioning?,Alfred Kinsey,Carl Jung,B. F. Skinner,Carl Rogers,Ivan Pavlov,E
When a person experiences unexpected panic attacks it is called,Bipolar disorder,Panic disorder,Insanity,Agoraphobia,Post-traumatic stress disorder,B
When a person has anxiety about panic attacks in social or embarrassing situa-  tions?,Bipolar disorder,Panic disorder,Insanity,Agoraphobia,Post-traumatic stress disorder,D
When a person experiences extreme stress with biological and psychological  symptoms following a traumatic event it is called,Bipolar disorder,Panic disorder,Insanity,Agoraphobia,Post-traumatic stress disorder,E
When you get used to hearing trains pass by and you no longer notice the train it  is called,Habituation,Stimulus generalization,Convergence,Conditioning,None of the above,A
Visual sensory memory is called,Iconic memory,Echoic memory,Short-term memory,Chunking,Encoding,A
When a person experiences a period with manic and depressive periods it is called,Bipolar disorder,Panic disorder,Insanity,Agoraphobia,Post-traumatic stress disorder,A
"When a person has eating problems, poor body image and maintains low body  weight it is called",Anorexia nervosa,Bulimia nervosa,Schizophrenia,Histrionic personality,Somatoform disorder,A
LSD is which of the following?,Sedative,Narcotic,Stimulant,Hallucinogen,Cannabis,D
When a person binges on food and then expels the food through regurgitation or  diuretics it is called,Anorexia nervosa,Bulimia nervosa,Schizophrenia,Histrionic personality,Somatoform disorder,B
is a psychotic disorder.,Anorexia nervosa,Bulimia nervosa,Schizophrenia,Histrionic personality,Somatoform disorder,C
In Maslow’s hierarchy of needs if you are in the first stage you are experiencing  which need?,Safety,Food,Respect from others,Love,Realized full potential,B
Codeine is which of the following?,Sedative,Narcotic,Stimulant,Hallucinogen,Cannabis,B
Alcohol is which of the following?,Sedative,Narcotic,Stimulant,Hallucinogen,Cannabis,A
In Maslow’s hierarchy of needs if you are in the fifth stage you are experiencing  which need?,Safety,Food,Respect from others,Love,Realized full potential,E
Which of the following is NOT one of Kiibler-Ross’s Stages of Dying?,Denial,Anger,Bargaining,Miracle treatments,Acceptance,D
"To study something unobtrusively, which of the following research method should  be used?",Case study,Longitudinal study,Survey,Experiment,Naturalistic observation,E
When a single male legally mates with many different females it is called,Rotation theory,Polygyny,Monogamy,Adaptive,Sexual selection,B
"MDMA (Ecstasy), GHB, Rohypnol (Ruffies), Clarity, and Ketamine (Special K)  area all examples of what kinds of drugs?",Depressants,Club drugs,Uppers,Prescription drugs,None of the above,B
In Maslow’s hierarchy of needs if you are in the second stage you are experiencing  which need?,Safety,Food,Respect from others,Love,Realized full potential,A
When traits are determined by two genes it is called,Monogenic,Polygenic,Polygyny,Heritability,Mutations,B
What is the school of thought that examines the functions of the mind?,Cognitive,Behavioral,Biological,Psychoanalytical,Humanistic,A
What is the school of thought that revolves around the individual’s unconscious  motivation?,Cognitive,Behavioral,Biological,Psychoanalytical,Humanistic,D
Valium is which of the following?,Sedative,Narcotic,Stimulant,Hallucinogen,Cannabis,A
What is the school of thought that studies and observes behavior?,Cognitive,Behavioral,Biological,Psychoanalytical,Humanistic,B
Which area of the brain is related to hearing?,Occipital lobe,Temporal lobe,Frontal lobe,Parietal lobe,Cerebral cortex,B
Which area of the brain is related to intelligence?,Occipital lobe,Temporal lobe,Frontal lobe,Parietal lobe,Cerebral cortex,C
This part of the eye protects and manages its shape?,Sclera,Iris,Pupil,Cornea,Lens,A
is a clear membrane in front of the eye.,Sclera,Iris,Pupil,Cornea,Lens,D
is a ring of muscles that make up the colored part of the eye.,Sclera,Iris,Pupil,Cornea,‘Lens,B
The part of the eye that looks black and is the opening of the iris is called,Sclera,Iris,Pupil,Cornea,dens,C
The is at the back of the eye and is light sensitive.,Sclera,Iris,Pupil,Cornea,Retina,E
Circadian rhythms complete,Every 24 hours,Every day,Every 28 days,Less than 24 hours,None of the above,A
Infradian rhythms complete,Every 24 hours,Longer than 24 hours,Every 28 days,Less than 24 hours,None of the above,B
Which of the following is NOT one of the six primary emotions?,Sadness,Happiness,Pear,Surprise,Anxiety,E
Which area is the largest part of the brain?,Occipital lobe,Temporal lobe,Frontal lobe,Hypothalamus,Cerebral cortex,E
If you need to study the long-term effects of smoking which of the following  would you use?,Case study,Longitudinal study,Survey,Experiment,Naturalistic observation,B
Which area of the brain is related to vision?,Occipital lobe,Temporal lobe,Frontal lobe,Parietal lobe,Cerebral cortex,A
is also known as borderline personality disorder.,Anorexia nervosa,Bulimia nervosa,Schizophrenia,Histrionic personality,Somatoform disorder,D
Which part of the brain is responsible for storing memories?,Occipital lobe,Temporal lobe,Hippocampus,Parietal lobe,Cerebral cortex,C
When a person experiences real biological symptoms that cannot be explained by  any medical means it is called,Anorexia nervosa,Bulimia nervosa,Schizophrenia,Histrionic personality,Somatoform disorder,E
Which of the following are narcotics?,Peyote,"Codeine  Cy ESD  D) Advil  E) None of the above  The correct answer is B:) Codeine. Codeine is a narcotic, which is any drug derived  from opium.  54) Women’s menstrual cycles complete  A) Every 24 hours  B) Every day",Every 28 days,Less than 24 hours,None of the above,C
Marijuana is which of the following?,Sedative,Narcotic,Stimulant,Hallucinogen,Cannabis,E
In Maslow’s hierarchy of needs if you are in the third stage you are experiencing  which need?,Safety,Food,Respect from others,Love,Realized full potential,D
In Maslow’s hierarchy of needs if you are in the fourth stage you are experiencing  which need?,Safety,Food,Respect from others,Love,Realized full potential,C
Which of the following measures muscle activity?,Electroencephalographs,Electromyographs,Electrooculographs,Electrocardiographs,None of the above,B
Heroin is which of the following?,Sedative,Narcotic,Stimulant,Hallucinogen,Cannabis,B
Which of the following measures heart activity?,Electroencephalographs,Electromyographs,Electrooculographs,Electrocardiographs,None of the above,D
Which type of conditioning reinforces good behavior?,Operant conditioning,Extinction,Classical conditioning,Aversion therapy,None of the above,A
What is the process of removing the condition with the response?,Operant conditioning,Extinction,Classical conditioning,Aversion therapy,None of the above,B
Auditory sensory memory is called,Iconic memory,Echoic memory,Short-term memory,Chunking,Encoding,C
Which area of the brain is related to body sensations?,Occipital lobe,Temporal lobe,Frontal lobe,Parietal lobe,Cerebral cortex,D
When information is processed it is called,Iconic memory,Echoic memory,Short-term memory,Chunking,Encoding,E
When you have one or more pauses in breathing or shallow breaths while you  sleep it is called sleep,Walking,Talking,Snoring,Apnea,Encoding,D
What is the difference made to one’s mind by the process of assimilation?,Assimilation,Accommodation,Classification,Stage,Recall,B
Which of the following is a stimulant?,Cocaine,Beer,Wine,Cannabis,None of the above,A
The system houses the structures for memory and emotion.,Occipital,Temporal,Hippocampus,Limbic,Cerebral,D
What is the ability to group objects together on the basis of common features?,Assimilation,Accommodation,Classification,Stage,Recall,C
What is a period in a child’s development in which he or she is capable of under-  standing some things but not others?,Assimilation,Accommodation,Classification,Stage,Recall,D
What is the process of working something out in your head?,Egocentrism,Elaboration,Operation,Recognition,Conservation,C
Which of the following was a psychoanalyst?,Harry Harlow,Mary Ainsworth,Sigmund Freud,Jean Piaget,Lawrence Kohlberg,C
