Question,Option A,Option B,Option C,Option D,Option E,Answer
What is it called when you are able to reproduce knowledge from memory?,Assimilation,Accommodation,Classification,Stage  B,"Reéeall	E	Recall.
Which of the following created the pre-operational period?	Harry Harlow	Mary Ainsworth	Sigmund Freud	Jean Piaget	Lawrence Kohlberg	D	Jean Piaget.
What is the ability to identify correctly something encountered before?	Egocentrism	Elaboration	Operation	Recognition	Conservation	D	Recognition.  www.Pass YourClass.com © 2023 Breely Crush Publishing, LLC   oductory Psychology
What is the realization that objects or sets of objects stay the same even when they  are changes about or made to look different?	Egocentrism	Elaboration	Operation	Recognition	Conservation	E	Conservation.
Which of the following measures brain waves?	Electroencephalographs	Electromyographs	Electrooculographs	Electrocardiographs	None of the above	A	Electroencephalographs.
Which is a surgical procedure which removes the nerve tracts in the frontal lobes?	Chemical castration	Effort effect	MRI	Lobotomy	None of the above	D	Lobotomy.
Which of the following measures eye movement?	Electroencephalographs	Electromyographs	Electrooculographs	Electrocardiographs	None of the above	C	Electrooculographs.  © 2023 Breely Crush Publishing, LLC www.Pass YourClass.com 73   74 Introductory Psycho
Which of the following created the Theory of Moral Development?	Harry Harlow	Mary Ainsworth	Sigmund Freud	Jean Piaget	Lawrence Kohlberg	E	Lawrence Kohlberg.
Which of the following was an associate of Freud but believed that social motives  effected choices more than sexual urges?	Alfred Adler	Albert Bandura	Alfred Binet	Abraham Maslow	Lewis Terman	A	Alfred Adler.
Which of the following is an amphetamine?	Caffeine	Advil	Wine	LSD	None of the above	A	Caffeine. Caffeine is an amphetamine. It is a stimulant to the  central nervous system.
Trust vs. Mistrust is Erikson’s developmental stage which occurs while a	Infant	Toddler	Preschooler	School-age child	Adolescent	A	Infant.  www.PassYourClass.com © 2023 Breely Crush Publishing, LLC   ductory Psychology 75
is the earliest sound a child makes to communicate?	Babbling	Cooing	Echolalia	Crying	None of the above	D	Crying.
Which defense mechanism occurs when someone hides their feelings and does not  acknowledge them?	Denial	Suppression	Reaction formation	Projection	Displacement	B	Suppression.
What type of research is conducted by watching the subject?	Naturalistic observation	Longitudinal research	Conditioning	Operant conditioning	Extinction	A	Naturalistic observation.
Which of the following created the Stanford-Binet Intelligence Scale?	Alfred Adler	Albert Bandura	Alfred Binet	Abraham Maslow	Lewis Terman	E	Lewis Terman.  © 2023 Breely Crush Publishing, LLC www.Pass YourClass.com   76 __ Introductory Psycholo: :
When a child learns something from watching another person perform this task it  is called	Shaping	Behavior rehearsal	Modeling	Incongruence	None of the above	C	Modeling.
Which of the following is NOT a monocular cue?	Size	Texture	Overlap	Linear perspective	Double vision	E	Double vision.
Which of the following created the Theory of Needs?	Alfred Adler	Albert Bandura	Alfred Binet	Abraham Maslow	Lewis Terman	D	Abraham Maslow.
Combining small pieces of information into bigger pieces of information is called	Iconic memory	Echoic memory	Short-term memory	Chunking	Encoding	D	Chunking.  www.Pass YourClass.com © 2023 Breely Crush Publishing, LLC   t oductory Psychology
A sedative drug will	Decrease heart rate	Increase heart rate	Improve eye sight	Increase endorphins	None of the above	A	Decrease heart rate. Sedatives produce a relaxing effect, but  not sleep.
Which of the following believed in a collective unconscious that holds universal  human memories?	Alfred Kinsey	Carl Jung	B. F. Skinner	Carl Rogers	Ivan Pavlov	B	Carl Jung.
Which of the following conducted the famous Bobo doll study, showing that chil-  dren do not need negative nor positive reinforcement to learn?	Alfred Adler	Albert Bandura	Alfred Binet	Abraham Maslow	Lewis Terman	B	Albert Bandura.
Ultradian rhythms complete	Every 24 hours	Every day	Every 28 days	More than once per day	None of the above	D	More than once per day.  © 2023 Breely Crush Publishing, LLC www.Pass YourClass.com 77   78 Introductory Psychol
Which of the following statements is the best example of telegraphic speech?	My oldest and prettiest sister will visit with us next week	My sister will visit next week	Sister visit week	My sister will be coming to visit me next week for three days	None of the above	C	Sister visit week. Telegraphic speech is a speech pattern  which eliminates function words, and keeps only the content words of a sentence.
Which of the following created the Binet-Simon scale which was later revised into  an intelligence test?	Alfred Adler	Albert Bandura	Alfred Binet	Abraham Maslow	Lewis Terman	C	Alfred Binet.
Which of the following was a leading sex researcher?	Alfred Kinsey	Carl Jung	B. F. Skinner	Carl Rogers	Ivan Pavlov	A	Alfred Kinsey.
What is the school of thought that believes all people are inherently good?	Cognitive	Behavioral	Biological	Psychoanalytical	Humanistic	E	Humanistic.  www.Pass YourClass.com © 2023 Breely Crush Publishing, LLC   Juctory Psychology
Which of the following correctly shows the personality types represented by the  acronym OCEAN?	Affectionate, conscientiousness, extroversion, neuroticism, and openness	Extroversion, neuroticism, friendliness, openness, and kindness	Conscientiousness, extroversion, agreeableness, neuroticism, and openness	Openness, niceness, conscientiousness, extroversion, and agreeableness	None of the above	C	Conscientiousness, extroversion, agreeableness, neuroticism,  and openness. OCEAN refers to the Big Five personality types.
Another name for working memory is	Iconic memory	Echoic memory	Short-term memory	Chunking	Encoding	C	Short-term memory.
What is the school of thought that believes the behavior and personality are linked  to genes?	Cognitive	Behavioral	Biological	Psychoanalytical	Humanistic	C	Biological.  © 2023 Breely Crush Publishing, LLC www.PassYourClass.com   80 _ Introductory Ps ycho
Agreeableness is one of the big five personality types. Which of the following is  NOT a characteristic of agreeableness?	Friendly	Sensitive	Compassionate	None of the above	All of the above	B	Sensitive. Agreeableness describes a person who is trusting,  altruistic, kind, affectionate, compassionate, and cooperative. Sensitivity is a character-  istic of neuroticism.
Which of the following studied operant conditioning?	Alfred Kinsey	Carl Jung	B. F. Skinner	Carl Rogers	Sigmund Freud	C	B. F. Skinner.
When a person has a fear of spiders it is called	Obsessive-compulsive disorder	Depression	Arachnophobia	Claustrophobia	Mania	C	Arachnophobia.
Another word for average	Mode	Median	Mean	Standard deviation	None of the above	C	Mean.  www.Pass YourClass.com © 2023 Breely Crush Publishing, LLC   roductory Psychology 81
A person who does not enjoy the activities they used to. They also experience a  range of other symptoms include lethargy. They are suffering from	Obsessive-compulsive disorder	Depression	Arachnophobia	Claustrophobia	Mania	B	Depression.
What is it called when a person has a fear of enclosed spaces, such as elevators?	Obsessive-compulsive disorder	Depression	Arachnophobia	Claustrophobia	Mania	D	Claustrophobia.
In therapy, a negative behavior is reinforced by a shock.	Aversion	Client-centered	Psychoanalytical	Group	None of the above	A	Aversion.
When a patient starts with small steps to overcome a difficult obstacle it is  called	Shaping	Behavior rehearsal	Modeling	Incongruence	None of the above	A	Shaping.  © 2023 Breely Crush Publishing, LLC www.Pass YourClass.com   82 Introductory Psych
Anosmia is the loss of	Sight	Hearing	Smell	Touch	Both B and C	C	Smell. Anosmia is the partial or complete loss of smell.  Partial anosmia is common with sinus infections or colds, but it can also become per-  manent with other problems such as old age.
What is the belief that you are the center of the universe?	Egocentrism	Elaboration	Operation	Recognition	Conservation	A	Egocentrism.
Sleep walking occurs in what stage of sleep?	Stage 1	Stage 2	Stage 3	Stage 4	Stage 5	D	Stage 4.
The Big Five personality types are assessed through a test. People with similar  scores	Tend to work well together	Should not work together	Do not balance each other out	Two of the above	None of the above	A	Tend to work well together. People with similar scores usu-  ally have similar work attitudes, similar problem solving methods, and respond well to  each other’s demeanor.  www.Pass YourClass.com © 2023 Breely Crush Publishing, LLC   83 roductory Psychology
The ability of an individual to tie their shoes with little conscious thought is a  result of which type of memory?	Procedural memory	Explicit memory	Sensory memory	Long-term memory	Episodic memory	A	Procedural memory. Procedural memory is also known as  implicit memory. These are memories that are specifically related to performing certain  actions (or procedures) that become almost automatic due to frequent repetition. Over  time these actions essentially become automatic because they have been stored in this  portion of long-term memory.
A person routinely turns the light on and off several times. They are suffering  from	Obsessive-compulsive disorder	Depression	Arachnophobia	Claustrophobia	Mania	A	Obsessive-compulsive disorder.
It typically takes about how many minutes to reach REM sleep?	5	20  Cy 30  D) 60  E) 90  The correct answer is E:) 90. It typically takes 90 minutes to reach REM sleep.  © 2023 Breely Crush Publishing, LLC www.PassYourClass.com   84 Introductory Psych  119) If an individual believes that their actions control what happens in their lives they  have a(n)  A) External locus of control  B) Learned helplessness	Internal locus of control	Situational attribution	Intrinsic attribution	C	Internal locus of control. Locus of control is used to describe  the scope of control an individual feels they have in their environment. An internal  locus indicates that a person feels that they have control. An external locus indicates  that an individual feels that their environment is controlled by factors outside their  control.
A family moves to the United States from Mexico. With time, they begin to take  on elements of American culture; however, they strive to retain some elements of  their Mexican culture as well. This describes	Assimilation	Cultural pluralism	Acculturation	Racial discrimination	None of the above	C	Acculturation. Assimilation, on the other hand, would involve  the initial culture being supplanted by the new culture.
According to Erikson’s developmental stages, what basic conflict is associated  with the early childhood stage?	Autonomy vs. Shame and Doubt	Trust vs. Mistrust	Initiative vs. Guilt	Industry vs. Interiority	None of the above	A	Autonomy vs. Shame and Doubt. During early childhood,  children experience the autonomy vs. shame and doubt conflict while they potty train.  www.Pass YourClass.com © 2023 Breely Crush Publishing, LLC   roductory Psychology
The tendency to seek balance and normalcy is called	Centrality	Helplessness	Dialectics	Homeostasis	Attribution	D	Homeostasis. Homeostasis is also called equilibrium. The  human body will naturally seek to maintain balance. Imbalance is a sign that something  is wrong. For example, a fever is a lack of homeostasis in temperature and signals sick-  ness.
Which of the following does NOT describe a problem of test validity?	It does not adequately demonstrate differences between individuals or  circumstances.	It does not give a consistent or standard score between individuals or  different takings.	It does not accurately test the information that it is meant to.	All of the above describe problems with test validity.	None of the above	B	It does not give a consistent or standard score between indi-  viduals or different takings. This describes a problem of test reliability, not test validity.
Eating or sleep disorders are classified in which axis of the DSM-IV?	Axis I	Axis II	Axis III	Axis IV	None of the above	A	Axis I. Axis I includes clinical disorders usually diagnosed in  infancy, childhood, or adolescence.  © 2023 Breely Crush Publishing, LLC www.Pass YourClass.com   86 Introductory Psychol 73
According to Karen Horney, neurosis is	Acoping technique	Caused by abuse and neglect in childhood	An uncommon occurrence	All of the above	None of the above	A	A coping technique. Horney saw neurosis as an attempt to  make life bearable.
The first IQ test was the	Simon-Binet scale	RIASEC	Rorschach Inkblot Test	DSM-IV	None of the above	A	Simon-Binet scale. The test was meant to be used in schools  to determine which children should be placed in special classrooms for mental retarda-  tion.
Galvanic skin response is measured for use in	Autoimmune tests	Polygraph tests	Frequency exams	Association tests	Rooting reflex tests	B	Polygraph tests. The tests work because when a person  becomes anxious or angry or aroused the autonomic nervous system automatically re-  sponds with changes in blood pressure or temperature. These changes are measurable  through the skin and can be powerful signs that a person is lying.  www.Pass YourClass.com © 2023 Breely Crush Publishing, LLC   7 ? luctory Psychology
Which of the following is not a regulation for animal research studies?	Humane living conditions	Least amount of suffering	Regularly inspecting housing areas	Obtained legally	All of the above are regulations involved in animal research studies	E	All of the above are regulations involved in animal research  studies. The use of animal research in psychological studies in invaluable. To protect  animals from possible abuse, the APA established guidelines ensuring their humane  treatment.
Free association is based on the theory that	Aperson’s unconscious thoughts will eventually surface	Individuals have no control over their conscious thought	Unconscious behaviors will never manifest consciously	Thoughts of freedom tend to associate with happiness	None of the above	A	A person’s unconscious thoughts will eventually surface. This  is a pattern developed by Freud to replace hypnosis in treatment. The ultimate goal  of the therapist is to link the pattern of answers given by a patient to the underlying  problem, hidden memories, or repressed emotions.
When was the first psychology lab established?	1517	1776	1810	1879	1961	D	1879. The world’s first psychology lab is credited to Wilhelm  Wundt in Germany. The lab was established in 1879 and was an academic lab devoted  to the study of psychology.  © 2023 Breely Crush Publishing, LLC www.PassYourClass.com   88 Introductory Psych |
Newborns reflexively turn their heads and open their mouths when their cheeks)  are touched. This is referred to as the	Grasp reflex	Rooting reflex	Parachute reflex	Tonic reflex	Startle reflex	B	Rooting reflex. The purpose of this reflex is to encourage  successful breastfeeding in newborns. When their cheek is stroked they will turn in that  direction and begin a sucking motion.
Which of the following correctly pairs a dependent and an independent variable?	Independent: Temperature, Dependent: Cooking time	Dependent: Study time, Independent: Test score	Independent: Number of friends, Dependent: Social skills	Dependent: Number of chickens, Independent: Eggs laid	Independent: Calories burned, Dependent: Distance run	A	Independent: Temperature, Dependent: Cooking time. Inde-  pendent variables are the aspects of a situation which effect or determine the measure  of other variables. In the example, the amount of time it takes for something to cook  will depend on the temperature it is cooking at. In each of the other four examples, the  dependent and independent variables have been swapped.
What links the two sides of the brain?	Brain stem	Cerebral cortex	Frontal lobe	Corpus callosum	Motor cortex	D	Corpus callosum. The corpus callosum is the highest content  of white matter in the brain. It is structured to transmit impulses from one side of the  brain to the other as fast as possible.  www.Pass YourClass.com © 2023 Breely Crush Publishing, LLC   roductory Psychology
Which type of therapy is most likely to use token economies?	Operant conditioning	Free association	Classical conditioning	Cognitive dissonance	Situational conditioning	A	Operant conditioning. Operant conditioning based on prin-  ciples of rewards and consequences for actions. Token economies use tokens as a form  of reward which makes the two theories work well together.
A person who views their own culture as superior to all others is said to be	Acculturated	Egocentric	Stereotypical	Ethnocentric	None of the above	D	Ethnocentric. A person with an ethnocentric mindset will  often view their own culture as dominant and then rank all others in relation to it. Eth-  nocentricity will often lead to stereotyping and racism.
Which of the following describes cognitive dissonance theory?	It is natural for the mind to allow some confusion to exist, and it will not  seek answers to troubling or frightening questions.	When individuals experience contradicting situations they will seek to  achieve consistency in their minds by changing attitudes or beliefs about the  situations.	Different individuals are able to view situations in different ways. Often men  and women have different cognitive functions that lead them to different  conclusions.	There is a tendency for the mind to search for contradicting opinions.  Contractions bring stability and consistency of thought.	None of the above	B	When individuals experience contradicting situations they  will seek to achieve consistency in their minds by changing attitudes or beliefs about  the situations. Cognitive dissonance is based on the fact that all people experience con-  tradictions at some point. The brain will naturally seek to reconcile them, which means  either new information must come forward, or a belief must change.  © 2023 Breely Crush Publishing, LLC www.Pass YourClass.com   90 Introductory Psych
If you believe that a person makes a choice because “that’s just the way that they  are” it is an example of	Dispositional attribution	Situational attribution	Extrinsic attribution	Collective attribution	Intrinsic attribution	A	Dispositional attribution. Dispositional attribution is the  theory that an individual’s choices are derived from within themselves. This viewpoint  claims that an individual’s choices are made internally based on personality. In con-  trast, situational attribution is the viewpoint that choices are reflective of situations.
Which of the following is most likely to be an intrinsic motivator?	Cleaning the house out of a desire for praise	Studying before a test to get a good grade	Working overtime for more money	Running a marathon to get a trophy	Doing a puzzle for the sense of accomplishment	E	Doing a puzzle for the sense of accomplishment. Intrinsic  motivators are motivations that come from within an individual. Praise, happiness, and  contentment are all powerful forces that motivate people to act. Extrinsic motivators  are typically in the form of rewards and punishments.
Learned helplessness occurs when	An individual is repeatedly exposed to rewards and loses desire to make  their own decisions	An individual is repeatedly told that they are helpless and they begin to  believe it	An individual is repeatedly given opportunities to change their situation but  don’t	An individual is repeatedly deprived of necessities of life and loses will to  live	An individual is repeatedly subjected to an adverse stimulus over which they  have no control	E	An individual is repeatedly subjected to an adverse stimulus  over which they have no control. This creates a feeling in the subject that they have no  control over their situation and they stop trying to avoid the stimulus.  www.PassYourClass.com © 2023 Breely Crush Publishing, LLC   lctory Psycholoay
What is the process of relating new information to something familiar?	Egocentrism	Elaboration	Operation	Recognition	Conservation	B	Elaboration.
Which of the following drugs is approved by the FDA to treat insomnia?	Xanax	Lunesta	Claratin	Mescaline	None of the above	B	Lunesta. Lunesta is approved by the FDA to treat insomnia.
Which of the following is NOT a category of long-term memory?	Procedural memory	Declarative memory	Implicit memory	Sensory memory	Explicit memory	D	Sensory memory. Sensory memory has the shortest span,  typically less than one second, and processes the greatest amount of information. It  holds the record of all events relating to the five senses. If information isn’t immedi-  ately important, it is typically forgotten instantly.
An aptitude test may be used to	Screen employees for job positions	Test the fitness of an individual	Help determine what jobs would be best for a person	Both A and C	None of the above	D	Both A and C. They can be based on anything from numeric  abilities, abstract reasoning, mechanical knowledge or any other information consid-  ered important to the employer.  © 2023 Breely Crush Publishing, LLC www.PassYourClass.com   92 Introductory Psycholog
A dog that bypasses its food bowl and goes straight to its master is considered to  be at the level of Maslow’s Hierarchy of Needs.	Self-actualization	Esteem needs	Belongingness and love needs	Safety needs	Physiological needs	C	Belongingness and love needs. At this level in Maslow’s  Hierarchy of Needs, a dog/person seeks intimate relationships or the need for social  interactions.
Justification of , trained personnel, proper caring and housing of  animal subjects, lawful animal acquisition, and documentation of experimental  procedures are just a few of the specific requirements that must be satisfied when  using animals for psychological experiments.	Existence	Research	Documentation	File-sharing	None of the above	B	Research. The American Psychological Association has pro-  vided strict guidelines that must be adhered to when using animal subjects.
By boosting and serotonin, the ADHD drug Ritalin can help a person  concentrate more fully on a given task or activity.	Histamine	Norepinephrine	Dopamine	Epinephrine	None of the above	C	Dopamine. The other options are also monoamine neurotrans-  mitters, but do not have the same interaction with Ritalin.  www.Pass YourClass.com © 2023 Breely Crush Publishing, LLC   roductory Psychology
Light waves travel as waves, which can travel through a vacuum.  Sound waves are known to travel as waves, which cannot travel  through a vacuum.	Latitudinal, longitudinal	Longitudinal, transverse	Transverse, longitudinal	Longitudinal, latitudinal	None of the above	C	Transverse, longitudinal. The other answers are variations on  the correct answer.  is a tactic used to get someone to agree to a larger request after they  agree to a more reasonable request first.  A) Toe-in-the-door technique  B) Finger-in-the-door technique  C) Neck-in-the-door technique  D) Arm-in-the-door technique  E) Foot-in-the-door technique  The correct answer is E:) Foot-in-the-door technique.
A is any agent that can cause disruption in the development of an  embryo or fetus.	Dodecatogen	Teratogen	Decatogen	Tetratogen	Hexatogen	B	Teratogen. Teratogens can be classified as a drug, chemical,  infection, or even radiation.  © 2023 Breely Crush Publishing, LLC www.Pass YourClass.com   94 Introductory Psych
The central nervous system (CNS) is composed of the and the	Brain, spinal cord	Brain, skeletal structure	Spinal cord, muscle structure	Spinal cord, pituitary gland	None of the above	A	Brain, spinal cord. The CNS is part of the nervous system  as a whole and contains the brain and spinal cord. The peripheral nervous system is  also part of the nervous system as a whole and is composed of myelinated sensory and  motor neurons that level the CNS.
processing refers to your brain processing information as it comes  in, while processing is your brain’s application of knowledge and  what it perceives to fill in the blanks.	Top-down, bottom-up	Top-down, sideways	Bottom-up, sideways	Bottom-up, top-down	Sideways, bottom-up	D	Bottom-up, top-down.
During the stage of sleep, more than 50% of the waves seen on an  EEG graph are delta waves.	First	Second	Third	Fourth	REM	D	Fourth. The third and fourth stage both produce delta waves  since this is when we are in delta sleep, but stage four produces more than 50% of the  delta waves, meaning we are in a deep sleep.  www.Pass YourClass.com © 2023 Breely Crush Publishing, LLC   uctory Psychology 95
The of light signifies the intensity of a light relative to similar light  wavelengths.	Attitude	Amplitude	Latitude	Longitude	None of the above	B	Amplitude. The other answers are variations on the correct  answer.  Test Taking Strategies  Here are some test-taking strategies that are specific to this test and to other CLEP tests  in general:  ¢ Keep your eyes on the time. Pay attention to how much time you have left.  ¢ Read the entire question and read all the answers. Many questions are not as  hard to answer as they may seem. Sometimes, a difficult sounding question re-  ally only is asking you how to read an accompanying chart. Chart and graph  questions are on most CLEP tests and should be an easy free point.  ¢ Ifyou don’t know the answer immediately, the new computer-based testing lets  you mark questions and come back to them later if you have time.  ¢ Read the wording carefully. Some words can give you hints to the right answer.  There are no exceptions to an answer when there are words in the question such  as “always” “all” or “none.” If one of the answer choices includes most or some  of the right answers, but not all, then that is not the answer. Here is an example:  The primary colors include all of the following:  Red, Yellow, Blue, Green  Red, Green, Yellow  Red, Orange, Yellow  Red, Yellow, Blue  None of the above  © 2023 Breely Crush Publishing, LLC www.PassYourClass.com
Which of the following is a type of sleep pattern  that becomes less prevalent as one moves from  infancy to adulthood?	Alpha	Beta	Gamma	Theta	REM	C	Refer to official CLEP answer key.
According to current psychological research,  hypnosis is most useful for which of the  following purposes?	Pain control	Age regression	Treatment of psychotic behavior	Treatment of a memory disorder	Treatment of a personality disorder	B	Refer to official CLEP answer key.
Checking the coin return every time one passes a  vending machine is a type of behavior probably  being maintained by which of the following schedules of reinforcement?	Fixed interval only	Fixed ratio only	Variable ratio only	Variable interval and fixed ratio	Fixed interval and variable ratio 20. Making the amount of time a child can spend  playing video games contingent on the amount  of time the child spends practicing the piano is an illustration of  (A) frequency theory  (B) the law of association  (C) aversive conditioning  (D) classical conditioning  (E) operant conditioning	D	Refer to official CLEP answer key.
Which of the following strategies undermines  the effectiveness of punishment?	Delaying punishment	Using punishment just severe enough to  be effective	Making punishment consistent	Explaining punishment	Minimizing dependence on physical punishment	A	Refer to official CLEP answer key.
A teacher tells a child to sit down in class. Over  the course of several days, the child stands up more and more frequently, only to be told to sit down each time. It is most likely that the teacher’s reprimands are serving as	a punishment	approval	a reinforcer	an aversive stimulus	a conditioned stimulus	C	Refer to official CLEP answer key.
Which of the following is a secondary  reinforcer?	Food	Warmth	Water	Money	Sex	E	Refer to official CLEP answer key.",
