"Module 1 Basic Economic Concepts","Term","Definition","Example","CLEP Trap","Related Formula/Relationship"
"Module 2 Product Markets – Firm Behavior and Market Structure","Monopolistic competition characteristics","Market with many firms selling differentiated products and free entry/exit","Restaurants in a city offering different cuisines and styles","Students call any firm with market power a monopoly; here, many firms exist and entry is easy","N/A"
"Module 2 Product Markets – Firm Behavior and Market Structure","Monopolistic competition long run","Entry and exit drive economic profit to zero; each firm faces downward-sloping demand tangent to ATC at profit-maximizing output","Demand curve just touches ATC at Q where MR = MC","Students assume long-run production occurs at minimum ATC; in fact, there is excess capacity","Long-run: zero economic profit but P > MC and not at min ATC"
"Module 2 Product Markets – Firm Behavior and Market Structure","Excess capacity (monopolistic competition)","Firm produces less than the output level that minimizes ATC in the long run","A coffee shop could lower ATC by serving more customers but demand isn't high enough","Students think zero economic profit implies fully efficient production at minimum ATC","Actual Q < Q at minimum ATC"
"Module 2 Product Markets – Firm Behavior and Market Structure","Oligopoly characteristics","Market with few large firms, barriers to entry, and strategic interdependence","Airline industry with few major carriers","Students treat oligopoly like perfect competition or monopoly without considering strategic behavior","N/A"
"Module 2 Product Markets – Firm Behavior and Market Structure","Game theory and payoff matrix","Framework to analyze strategic interactions where payoff depends on own and rivals' choices","Two firms choosing high or low prices with payoffs shown in a matrix","Students select highest joint payoff instead of checking for Nash equilibrium stability","N/A"
"Module 2 Product Markets – Firm Behavior and Market Structure","Nash equilibrium","Outcome where no player can gain by unilaterally changing strategy given others' strategies","Both firms choose 'high price' if deviation alone would lower their payoff","Students think Nash outcome must maximize total industry profit; it need not","N/A"
"Module 3 Factor Markets","Term","Definition","Example","CLEP Trap","Related Formula/Relationship"
"Module 3 Factor Markets","Derived demand for labor","Demand for labor that arises from demand for the goods and services labor helps produce","Higher demand for cars increases demand for auto workers","Students treat labor demand as independent of product market conditions","N/A"
"Module 3 Factor Markets","Marginal revenue product (MRP)","Additional revenue a firm earns by employing one more unit of a factor of production","If one more worker produces 5 units and each sells for $10, MRP = $50","Students forget to multiply marginal product by price or MR when computing MRP","MRP = MP × MR (in perfect competition, MP × price)"
"Module 3 Factor Markets","Marginal factor cost (MFC)","Additional cost of hiring one more unit of a factor","In a competitive labor market, MFC equals the wage rate","Students use average wage instead of marginal cost when applying hiring rule","In competitive labor market, MFC = wage"
"Module 3 Factor Markets","Hiring rule for labor","Profit-maximizing firm hires labor up to the point where marginal revenue product equals marginal factor cost","Firm hires workers until MRP = wage","Students keep hiring as long as MRP is positive instead of comparing to wage","Hire until MRP = MFC"
"Module 3 Factor Markets","Labor demand curve","Downward-sloping curve showing quantity of labor firms hire at each wage, equal to MRP curve","Lower wage increases quantity of labor demanded by firms","Students confuse individual firm’s labor demand with market labor demand but shape is same (downward-sloping)","N/A"
"Module 3 Factor Markets","Labor supply curve","Upward-sloping curve showing quantity of labor workers supply at each wage (market level)","Higher wage induces more workers to enter the labor force or work more hours","Students draw firm's labor supply as upward sloping; for competitive firm, supply is horizontal at market wage","N/A"
"Module 3 Factor Markets","Competitive labor market equilibrium","Wage and employment level where market labor supply equals market labor demand","At $20 per hour, firms demand and workers supply 10,000 labor hours","Students think an individual firm can affect wage; competitive firms are wage takers","N/A"
"Module 3 Factor Markets","Shifters of labor demand","Changes in product demand, worker productivity, or prices of other inputs shift labor demand","New technology increases labor productivity, shifting labor demand right","Students ignore effect of output demand on derived labor demand","N/A"
"Module 3 Factor Markets","Shifters of labor supply","Changes in population, preferences for work vs leisure, or alternative opportunities shift labor supply","Increase in working-age population shifts labor supply right","Students mix up demand and supply shifters when wages change","N/A"
"Module 3 Factor Markets","Monopsony (advanced)","Single or dominant buyer of labor facing an upward-sloping labor supply, resulting in wage-setting power below competitive level","Company town with one major employer","Students apply competitive labor market logic (wage = MRP) instead of monopsony condition","Monopsony hires where MRP = MFC, pays lower wage from supply curve"
"Module 4 Market Failure and Role of Government","Term","Definition","Example","CLEP Trap","Related Formula/Relationship"
"Module 4 Market Failure and Role of Government","Negative externality","Spillover cost imposed on third parties not reflected in market transactions, leading to overproduction","Pollution from a factory harming nearby residents' health","Students shift demand instead of supply when externality is due to production costs","MSC > MPC; market Q > socially optimal Q"
"Module 4 Market Failure and Role of Government","Positive externality","Spillover benefit received by third parties not reflected in market transactions, leading to underproduction","Vaccination providing herd immunity benefits to others","Students move supply when external benefit affects consumption (demand side)","MSB > MPB; market Q < socially optimal Q"
"Module 4 Market Failure and Role of Government","Socially optimal quantity","Output level where marginal social benefit equals marginal social cost, internalizing externalities","Setting pollution tax so that firms reduce emissions to Q* where MSC = MSB","Students confuse private equilibrium (MPB = MPC) with social optimum (MSB = MSC)","MSB = MSC at Q*"
"Module 4 Market Failure and Role of Government","Pigouvian tax","Tax imposed on a good with negative externalities equal to marginal external cost to correct overproduction","Per-unit pollution tax that aligns private and social costs","Assuming any tax is Pigouvian; it must be calibrated to external cost to hit social optimum","Tax set so MPC + tax = MSC at Q*"
"Module 4 Market Failure and Role of Government","Pigouvian subsidy","Subsidy on goods with positive externalities equal to marginal external benefit to correct underproduction","Subsidy for education encouraging more schooling to socially optimal level","Students confuse generic subsidies (price supports) with targeted externality subsidies","Subsidy set so MPB + subsidy = MSB at Q*"
"Module 4 Market Failure and Role of Government","Public good","Good that is nonrival and nonexcludable, meaning one person's use doesn't reduce availability and non-payers can't be easily excluded","National defense protecting all residents in a country","Students label any government-provided good as public good even when it is rival or excludable","N/A"
"Module 4 Market Failure and Role of Government","Free-rider problem","Situation where people benefit from a good without paying, leading to underprovision by private markets","People enjoying public fireworks without contributing to costs","Students apply free-rider logic to private, excludable goods, where firms can charge users","N/A"
"Module 4 Market Failure and Role of Government","Common resource","Good that is rival but nonexcludable, prone to overuse and depletion","Open-access fishery where anyone can fish and catches diminish","Students confuse common resources with public goods; commons are rival and get overused","N/A"
"Module 4 Market Failure and Role of Government","Tragedy of the commons","Overuse of a common resource because individuals ignore the external cost of their use on others","Overgrazing on common pasture land until grass is depleted","Students attribute overuse to high prices rather than lack of property rights or exclusion","N/A"
"Module 4 Market Failure and Role of Government","Club good","Good that is nonrival but excludable, often provided by private firms with membership or fees","Streaming service where additional users do not reduce others' enjoyment but access is restricted","Students lump club goods with public goods or private goods without checking rivalry and excludability","N/A"
"Module 4 Market Failure and Role of Government","Antitrust policy","Government laws and actions to promote competition and prevent monopolies and collusive behavior","Breaking up a dominant firm or preventing anti-competitive mergers","Students assume antitrust always lowers prices; some natural monopolies might need regulation rather than breakup","N/A"
"Module 4 Market Failure and Role of Government","Natural monopoly regulation","Government setting prices for a single-firm industry with declining ATC over relevant range to prevent excessive pricing","Utility regulator sets price = ATC so firm covers costs but earns zero economic profit","Students think price must always be set equal to MC, which could cause losses in natural monopoly","Regulated price often P = ATC for zero economic profit"